{
  "schema": "https://absolutejs.github.io/agents/schemas/agent-registry-index/v1.json",
  "generatedAt": "2026-07-31T19:07:01.841Z",
  "count": 2,
  "agents": [
    {
      "agent": {
        "$schema": "https://absolutejs.github.io/agents/schemas/agent-discovery/v1.json",
        "id": "https://absolutejs.github.io/agents/.well-known/absolute-agent.json",
        "name": "AbsoluteJS Registry Search Agent",
        "description": "Finds verified agents and production AbsoluteJS packages through open, static machine-readable indexes.",
        "version": "1.0.0",
        "url": "https://absolutejs.github.io/agents/",
        "publisher": {
          "id": "https://github.com/absolutejs",
          "name": "AbsoluteJS",
          "url": "https://github.com/absolutejs",
          "jwksUri": "https://absolutejs.github.io/agents/.well-known/jwks.json"
        },
        "capabilities": [
          {
            "id": "registry.agents.search",
            "title": "Search verified agents",
            "description": "Reads the signed public agent index and filters its discovery metadata.",
            "effects": [
              "read"
            ],
            "approval": "never",
            "tags": [
              "discovery",
              "registry",
              "agents"
            ]
          },
          {
            "id": "registry.packages.search",
            "title": "Search AbsoluteJS packages",
            "description": "Reads the public package catalog for agent-first framework capabilities.",
            "effects": [
              "read"
            ],
            "approval": "never",
            "tags": [
              "absolutejs",
              "packages",
              "discovery"
            ]
          }
        ],
        "interfaces": [
          {
            "type": "http",
            "url": "https://absolutejs.github.io/agents/v1/agents/index.json",
            "contentTypes": [
              "application/json"
            ]
          },
          {
            "type": "openapi",
            "url": "https://absolutejs.github.io/agents/openapi.json",
            "protocolVersion": "3.1.1"
          },
          {
            "type": "arazzo",
            "url": "https://absolutejs.github.io/agents/arazzo.json",
            "protocolVersion": "1.1.0"
          }
        ],
        "authentication": {
          "schemes": [
            "none"
          ]
        },
        "categories": [
          "developer-tools",
          "agent-discovery"
        ],
        "tags": [
          "absolutejs",
          "signed",
          "open-protocol"
        ],
        "languages": [
          "en"
        ],
        "documentationUrl": "https://github.com/absolutejs/agents#readme",
        "createdAt": "2026-07-16T00:00:00.000Z",
        "updatedAt": "2026-07-16T05:56:09.204Z"
      },
      "signatures": [
        {
          "algorithm": "Ed25519",
          "keyId": "https://absolutejs.github.io/agents/.well-known/jwks.json#absolutejs-registry-2026",
          "createdAt": "2026-07-16T05:56:09.206Z",
          "digest": "2X52qw1r95zYFLYQQdgyj2684Z0Z-o6tMUwQJw-YRO4",
          "value": "TgmVfA2JuhxJuXSQc0zJsWxJbaz9LlIfxiMVqlDjhPc44V7JDdpswmyuxHH_EpPClJBOTxIc_2hNXSKsvhdSDA"
        }
      ],
      "verified": true
    },
    {
      "agent": {
        "$schema": "https://absolutejs.github.io/agents/schemas/agent-discovery/v1.json",
        "authentication": {
          "authorizationServers": [
            "https://onspark.com"
          ],
          "protectedResourceMetadata": "https://onspark.com/.well-known/oauth-protected-resource",
          "schemes": [
            "oauth2",
            "oidc"
          ],
          "scopes": [
            "openid",
            "profile",
            "email",
            "mcp"
          ]
        },
        "capabilities": [
          {
            "approval": "never",
            "description": "Score a founder's partnership readiness from business context using the same assessment path as onSpark intake.",
            "effects": [
              "read"
            ],
            "id": "score_partnership_readiness",
            "price": {
              "amount": "0.00",
              "currency": "USD",
              "unit": "assessment"
            },
            "scopes": [
              "mcp"
            ],
            "tags": [
              "diagnostic",
              "partnership-readiness",
              "acquisition"
            ],
            "title": "Score partnership readiness"
          },
          {
            "approval": "never",
            "description": "Preview anonymized partner candidates by category, offer shape, and readiness without exposing member identities or contacts.",
            "effects": [
              "read"
            ],
            "id": "preview_match_candidates",
            "price": {
              "amount": "0.00",
              "currency": "USD",
              "unit": "preview"
            },
            "scopes": [
              "mcp"
            ],
            "tags": [
              "matching",
              "anonymized",
              "acquisition"
            ],
            "title": "Preview partner candidates"
          },
          {
            "approval": "never",
            "description": "Read the subscriber's introductions, guarantee progress, attributed pipeline, verified revenue, fees, and reports from the Deal Ledger.",
            "effects": [
              "read"
            ],
            "id": "get_deal_ledger_report",
            "price": {
              "amount": "799.00",
              "currency": "USD",
              "unit": "month (Access subscription)"
            },
            "scopes": [
              "mcp"
            ],
            "tags": [
              "deal-ledger",
              "revenue",
              "reporting",
              "subscription"
            ],
            "title": "Read the Deal Ledger"
          },
          {
            "approval": "policy",
            "description": "Research matches and create partnership briefs, one-pagers, deal assets, meeting preparation, tasks, and governed drafts for a subscriber.",
            "effects": [
              "read",
              "write"
            ],
            "id": "operate_partnership_workspace",
            "price": {
              "amount": "799.00",
              "currency": "USD",
              "unit": "month (Access subscription)"
            },
            "scopes": [
              "mcp"
            ],
            "tags": [
              "partnerships",
              "research",
              "assets",
              "subscription"
            ],
            "title": "Operate a partnership workspace"
          },
          {
            "approval": "always",
            "description": "Propose outreach, connection requests, calendar invitations, and other external partnership actions for explicit member approval.",
            "effects": [
              "write",
              "external",
              "communication"
            ],
            "id": "propose_partnership_action",
            "price": {
              "amount": "799.00",
              "currency": "USD",
              "unit": "month (Access subscription)"
            },
            "scopes": [
              "mcp"
            ],
            "tags": [
              "approval-required",
              "outreach",
              "introductions"
            ],
            "title": "Propose an external partnership action"
          },
          {
            "approval": "policy",
            "description": "Consult opted-in, published member agent cards to find relevant partnership fits with bilateral transparency logs.",
            "effects": [
              "read",
              "communication"
            ],
            "id": "scout_member_network",
            "price": {
              "amount": "799.00",
              "currency": "USD",
              "unit": "month (Access subscription)"
            },
            "scopes": [
              "mcp"
            ],
            "tags": [
              "agent-to-agent",
              "network",
              "opt-in",
              "subscription"
            ],
            "title": "Scout the onSpark member network"
          }
        ],
        "categories": [
          "partnership technology",
          "business growth",
          "revenue operations"
        ],
        "createdAt": "2026-07-17T00:00:00.000Z",
        "description": "Provider-neutral partnership co-pilot for scoring readiness, finding partners, operating deal workflows, and proving outcomes in the onSpark Deal Ledger.",
        "documentationUrl": "https://onspark.com/llms-full.txt",
        "examples": [
          {
            "capabilityId": "score_partnership_readiness",
            "prompt": "Assess whether my business is ready for strategic partnerships and explain the biggest gap.",
            "title": "Assess partnership readiness"
          },
          {
            "capabilityId": "preview_match_candidates",
            "prompt": "Preview the kinds of partners onSpark could find for a B2B events company.",
            "title": "Preview partner candidates"
          },
          {
            "capabilityId": "get_deal_ledger_report",
            "prompt": "Show what onSpark has delivered, what is moving, and what verified revenue is in my Deal Ledger.",
            "title": "Review delivered outcomes"
          }
        ],
        "iconUrl": "https://onspark.com/assets/icon-192-v2.png",
        "id": "https://onspark.com/.well-known/absolute-agent.json",
        "interfaces": [
          {
            "contentTypes": [
              "application/json",
              "text/event-stream"
            ],
            "protocolVersion": "2025-06-18",
            "type": "mcp",
            "url": "https://onspark.com/mcp"
          },
          {
            "contentTypes": [
              "application/json",